{
  "build_number": "0059",
  "candidate": "RC1",
  "peptide": "Tesamorelin",
  "clinical_recommendation_authorised": false,
  "clinical_decision_support_authorised": false,
  "record_type": "peptide_review_operating_model_transition",
  "record_id": "",
  "transition_id": "",
  "source_pilot": "Tesamorelin",
  "reusable_controls": [],
  "peptide_specific_controls": [],
  "prohibited_assumptions": [],
  "validation_state": "PARTIAL",
  "decision": "CONDITIONAL_HOLD",
  "approvers": []
}
